{
  "name": "Yahoo \u00b7 SerpApi",
  "links": {
    "docs": "https://serpapi.com/yahoo-search-api",
    "github": "https://github.com/dhruv-anand-aintech/anysearch",
    "website": "https://www.yahoo.com",
    "slug": "serpapi_yahoo"
  },
  "env_keys": {
    "value": "SERPAPI_API_KEY, SERPAPI_KEY",
    "source_url": "https://serpapi.com/search-api",
    "comment": "Same SerpApi key for all engines; anysearch uses `engine=\"yahoo\"`."
  },
  "python_extra": {
    "value": "google-search-results",
    "source_url": "https://pypi.org/project/google-search-results/",
    "comment": "pip extra `serpapi`; call with `provider=\"serpapi\"`, `engine=\"yahoo\"`."
  },
  "requires_key": {
    "support": "full",
    "source_url": "https://serpapi.com/search-api",
    "comment": "Valid API key required for every request."
  },
  "snippet": {
    "support": "full",
    "source_url": "https://serpapi.com/yahoo-search-api",
    "comment": "Organic results via SerpApi `engine=yahoo`."
  },
  "domains": {
    "support": "none",
    "source_url": "https://serpapi.com/yahoo-search-api",
    "comment": "Domain filters"
  },
  "country": {
    "support": "full",
    "source_url": "https://serpapi.com/yahoo-search-api",
    "comment": "Country (gl)"
  },
  "language": {
    "support": "full",
    "source_url": "https://serpapi.com/yahoo-search-api",
    "comment": "Language"
  },
  "date": {
    "support": "none",
    "source_url": "https://serpapi.com/yahoo-search-api",
    "comment": "Published date range"
  },
  "safe_search": {
    "support": "full",
    "source_url": "https://serpapi.com/yahoo-search-api",
    "comment": "`safe_search` on Yahoo engine."
  },
  "answer": {
    "support": "partial",
    "source_url": "https://serpapi.com/yahoo-search-api",
    "comment": "Answer box when the engine JSON includes one (not explicitly requested)."
  },
  "content": {
    "support": "none",
    "source_url": "https://serpapi.com/yahoo-search-api",
    "comment": "Full page text"
  },
  "summary": {
    "support": "none",
    "source_url": "https://serpapi.com/yahoo-search-api",
    "comment": "AI per-result summary"
  },
  "highlights": {
    "support": "none",
    "source_url": "https://serpapi.com/yahoo-search-api",
    "comment": "Query highlights"
  },
  "news": {
    "support": "full",
    "source_url": "https://serpapi.com/yahoo-search-api",
    "comment": "`search_type=news` \u2192 `engine=yahoo` on SerpApi."
  },
  "mode": {
    "values": [
      "balanced"
    ],
    "source_url": "https://serpapi.com/yahoo-search-api",
    "comment": "Fixed SerpApi backend `engine=yahoo` (set via anysearch `engine=\"yahoo\"` with `provider=\"serpapi\"`). No separate fast/deep tier on this engine."
  },
  "pricing_per_1k": {
    "value": "balanced: $25 starter; ~$3.75-$15 volume",
    "source_url": "https://serpapi.com/pricing",
    "comment": "Monthly plan price divided by included searches; applies to all SerpApi engine rows."
  },
  "free_tier_limits": {
    "value": "250 searches/month; 50/hour",
    "source_url": "https://serpapi.com/pricing",
    "comment": "Free plan applies across SerpApi engines; only successful uncached searches consume quota."
  },
  "p50_latency": {
    "value": "Light API: 1.28s p50 independent; fastest Google API: 0.73s avg / 1.45s p99 vendor-run",
    "source_url": "https://proxyway.com/research/search-apis-2026-report",
    "comment": "Independent p50 is for SerpApi Light, not a specific engine. SerpApi's own 100-plus-query comparison reports average and p99 for its fastest Google API; anysearch engine-specific latency remains unreported.",
    "links": {
      "Independent benchmark": "https://proxyway.com/research/search-apis-2026-report",
      "Provider benchmark": "https://serpapi.com/blog/who-has-the-fastest-google-search-api/"
    }
  },
  "notes": "SerpApi proxy to Yahoo (`engine=yahoo`). Native SDK package: google-search-results."
}
