{
  "name": "Brave",
  "links": {
    "docs": "https://api-dashboard.search.brave.com/app/documentation/web-search/get-started",
    "github": "https://github.com/dhruv-anand-aintech/anysearch",
    "website": "https://brave.com/search/api/",
    "slug": "brave"
  },
  "env_keys": {
    "value": "BRAVE_API_KEY, BRAVE_SEARCH_API_KEY",
    "source_url": "https://api-dashboard.search.brave.com/app/documentation/web-search/get-started",
    "comment": "API keys and configuration variables documented by the provider."
  },
  "python_extra": {
    "value": "\u2014 (REST only)",
    "source_url": "https://api-dashboard.search.brave.com/app/documentation/web-search/get-started",
    "comment": "HTTP API only; no required vendor Python SDK."
  },
  "requires_key": {
    "support": "full",
    "source_url": "https://api-dashboard.search.brave.com/app/documentation/web-search/get-started",
    "comment": "Valid API key required for every request."
  },
  "snippet": {
    "support": "full",
    "source_url": "https://api-dashboard.search.brave.com/app/documentation/web-search/get-started",
    "comment": "Web/news SERP snippets. Answers API has no ranked snippet list \u2014 use web search or citations."
  },
  "domains": {
    "support": "none",
    "source_url": "https://api-dashboard.search.brave.com/app/documentation/web-search/get-started",
    "comment": "Domain filters"
  },
  "country": {
    "support": "full",
    "source_url": "https://api-dashboard.search.brave.com/app/documentation/web-search/get-started",
    "comment": "`country` on web/news SERP. Answers API does not expose the same filters."
  },
  "language": {
    "support": "full",
    "source_url": "https://api-dashboard.search.brave.com/app/documentation/web-search/get-started",
    "comment": "`search_lang` and `ui_lang` on web search. Not on Answers chat completions."
  },
  "date": {
    "support": "full",
    "source_url": "https://api-dashboard.search.brave.com/app/documentation/web-search/get-started",
    "comment": "Web/news `freshness` presets (`pd`, `pw`, `pm`, `py`) or custom range. Answers: none."
  },
  "safe_search": {
    "support": "full",
    "source_url": "https://api-dashboard.search.brave.com/app/documentation/web-search/get-started",
    "comment": "Web/news `safesearch`: `off`, `moderate`, `strict`."
  },
  "answer": {
    "support": "full",
    "source_url": "https://api-dashboard.search.brave.com/app/documentation/ai-grounding",
    "comment": "Answers API: OpenAI-compatible grounded completion with citations. Web search returns SERP JSON only (no LLM answer field)."
  },
  "content": {
    "support": "partial",
    "source_url": "https://api-dashboard.search.brave.com/app/documentation/ai-grounding",
    "comment": "Answers API embeds cited source URLs in the completion. Web search has snippets, not full pages."
  },
  "summary": {
    "support": "none",
    "source_url": "https://api-dashboard.search.brave.com/app/documentation/web-search/get-started",
    "comment": "AI per-result summary"
  },
  "highlights": {
    "support": "full",
    "source_url": "https://api-dashboard.search.brave.com/app/documentation/web-search",
    "comment": "`extra_snippets=true` \u2014 up to 5 alternate excerpts per web result (Pro)."
  },
  "news": {
    "support": "full",
    "source_url": "https://api-dashboard.search.brave.com/app/documentation/web-search/get-started",
    "comment": "Dedicated `/res/v1/news/search` endpoint (not Answers API)."
  },
  "mode": {
    "values": [
      "balanced",
      "deep"
    ],
    "source_url": "https://api-dashboard.search.brave.com/app/documentation/web-search",
    "comment": "**Web/news SERP** (`/res/v1/web/search`) \u2192 matrix `balanced`. **Answers API** (`POST /res/v1/chat/completions`, `model=brave`) \u2192 balanced (single-pass grounded answer); `enable_research=true` (streaming)\u2192deep. Same `BRAVE_API_KEY`."
  },
  "pricing_per_1k": {
    "value": "balanced/search: $5; deep/answers: $4 + tokens",
    "source_url": "https://brave.com/search/api/",
    "comment": "Search is $5/1K requests; Answers is $4/1K plus input/output token charges."
  },
  "free_tier_limits": {
    "value": "$5 credits/month (~1,000 Search requests)",
    "source_url": "https://brave.com/search/api/",
    "comment": "Credits are applied automatically each month to Search or Answers usage."
  },
  "p50_latency": {
    "value": "Not publicly documented",
    "source_url": "https://api-dashboard.search.brave.com/app/documentation/web-search/get-started",
    "comment": "No provider-published p50 Web Search API latency was found."
  },
  "notes": "Web/news Search API is in the anysearch SDK; Answers API (`/res/v1/chat/completions`) is documented in the matrix but not wired in the SDK yet."
}
