{
  "name": "Google PSE",
  "links": {
    "docs": "https://developers.google.com/custom-search/v1/reference/rest/v1/cse/list",
    "github": "https://github.com/dhruv-anand-aintech/anysearch",
    "website": "https://programmablesearchengine.google.com",
    "slug": "google_pse"
  },
  "env_keys": {
    "value": "GOOGLE_PSE_API_KEY, GOOGLE_CSE_API_KEY, GOOGLE_API_KEY",
    "source_url": "https://developers.google.com/custom-search/v1/using_rest",
    "comment": "API keys and configuration variables documented by the provider."
  },
  "python_extra": {
    "value": "\u2014 (REST only)",
    "source_url": "https://developers.google.com/custom-search/v1/reference/rest/v1/cse/list",
    "comment": "HTTP API only; no required vendor Python SDK."
  },
  "requires_key": {
    "support": "full",
    "source_url": "https://developers.google.com/custom-search/v1/using_rest",
    "comment": "Valid API key required for every request."
  },
  "snippet": {
    "support": "full",
    "source_url": "https://developers.google.com/custom-search/v1/reference/rest/v1/cse/list",
    "comment": "Short description field returned with each result."
  },
  "domains": {
    "support": "partial",
    "source_url": "https://developers.google.com/custom-search/v1/reference/rest/v1/cse/list",
    "comment": "Single `siteSearch` + `siteSearchFilter` (`i` include / `e` exclude)\u2014first domain only."
  },
  "country": {
    "support": "full",
    "source_url": "https://developers.google.com/custom-search/v1/reference/rest/v1/cse/list",
    "comment": "`gl` \u2014 geolocation of end user."
  },
  "language": {
    "support": "full",
    "source_url": "https://developers.google.com/custom-search/v1/reference/rest/v1/cse/list",
    "comment": "`hl` UI language and `lr` lang_restrict."
  },
  "date": {
    "support": "partial",
    "source_url": "https://developers.google.com/custom-search/v1/reference/rest/v1/cse/list",
    "comment": "`sort=date:r:YYYYMMDD:YYYYMMDD` when both range ends are set."
  },
  "safe_search": {
    "support": "full",
    "source_url": "https://developers.google.com/custom-search/v1/reference/rest/v1/cse/list",
    "comment": "`safe`: `active` or `off`."
  },
  "answer": {
    "support": "none",
    "source_url": "https://developers.google.com/custom-search/v1/reference/rest/v1/cse/list",
    "comment": "AI answer"
  },
  "content": {
    "support": "none",
    "source_url": "https://developers.google.com/custom-search/v1/reference/rest/v1/cse/list",
    "comment": "Full page text"
  },
  "summary": {
    "support": "none",
    "source_url": "https://developers.google.com/custom-search/v1/reference/rest/v1/cse/list",
    "comment": "AI per-result summary"
  },
  "highlights": {
    "support": "none",
    "source_url": "https://developers.google.com/custom-search/v1/reference/rest/v1/cse/list",
    "comment": "Query highlights"
  },
  "news": {
    "support": "none",
    "source_url": "https://developers.google.com/custom-search/v1/reference/rest/v1/cse/list",
    "comment": "News search type"
  },
  "mode": {
    "values": [
      "balanced"
    ],
    "source_url": "https://developers.google.com/custom-search/v1/reference/rest/v1/cse/list",
    "comment": "Custom Search JSON API: no search-depth or speed preset\u2014only `num`, `sort`, and `siteSearch` filters. Matrix `balanced` = default `cse.list` behavior."
  },
  "pricing_per_1k": {
    "value": "balanced: $5",
    "source_url": "https://support.google.com/programmable-search/answer/9069107",
    "comment": "Custom Search JSON API and Programmable Search Element paid API are listed at $5/1K queries."
  },
  "free_tier_limits": {
    "value": "100 queries/day; existing customers only",
    "source_url": "https://developers.google.com/custom-search/v1/overview",
    "comment": "Custom Search JSON API is closed to new customers; existing customers must migrate by January 1, 2027."
  },
  "p50_latency": {
    "value": "No published distribution; each response includes server searchTime",
    "source_url": "https://developers.google.com/custom-search/v1/reference/rest/v1/Search",
    "comment": "Google exposes per-request server search time in searchInformation, but publishes no aggregate p50/p90/p95 latency for Custom Search JSON API."
  },
  "notes": ""
}
