{
  "name": "Kagi",
  "links": {
    "docs": "https://help.kagi.com/kagi/api/search.html",
    "github": "https://github.com/dhruv-anand-aintech/anysearch",
    "website": "https://kagi.com",
    "slug": "kagi"
  },
  "env_keys": {
    "value": "KAGI_API_KEY",
    "source_url": "https://help.kagi.com/kagi/api/search.html",
    "comment": "API keys and configuration variables documented by the provider."
  },
  "python_extra": {
    "value": "\u2014 (REST only)",
    "source_url": "https://help.kagi.com/kagi/api/search.html",
    "comment": "HTTP API only; no required vendor Python SDK."
  },
  "requires_key": {
    "support": "full",
    "source_url": "https://help.kagi.com/kagi/api/search.html",
    "comment": "Valid API key required for every request."
  },
  "snippet": {
    "support": "full",
    "source_url": "https://help.kagi.com/kagi/api/search.html",
    "comment": "Each result includes a `snippet`; length follows account Search settings."
  },
  "domains": {
    "support": "none",
    "source_url": "https://help.kagi.com/kagi/api/search.html",
    "comment": "Domain filters"
  },
  "country": {
    "support": "none",
    "source_url": "https://help.kagi.com/kagi/api/search.html",
    "comment": "Country (gl)"
  },
  "language": {
    "support": "none",
    "source_url": "https://help.kagi.com/kagi/api/search.html",
    "comment": "Language"
  },
  "date": {
    "support": "none",
    "source_url": "https://help.kagi.com/kagi/api/search.html",
    "comment": "Published date range"
  },
  "safe_search": {
    "support": "none",
    "source_url": "https://help.kagi.com/kagi/api/search.html",
    "comment": "Safe search"
  },
  "answer": {
    "support": "none",
    "source_url": "https://help.kagi.com/kagi/api/search.html",
    "comment": "AI answer"
  },
  "content": {
    "support": "none",
    "source_url": "https://help.kagi.com/kagi/api/search.html",
    "comment": "Full page text"
  },
  "summary": {
    "support": "none",
    "source_url": "https://help.kagi.com/kagi/api/search.html",
    "comment": "AI per-result summary"
  },
  "highlights": {
    "support": "none",
    "source_url": "https://help.kagi.com/kagi/api/search.html",
    "comment": "Query highlights"
  },
  "news": {
    "support": "none",
    "source_url": "https://help.kagi.com/kagi/api/search.html",
    "comment": "News search type"
  },
  "mode": {
    "values": [
      "balanced"
    ],
    "source_url": "https://help.kagi.com/kagi/api/search.html",
    "comment": "No request `mode`; snippet length comes from account Settings \u2192 Search."
  },
  "pricing_per_1k": {
    "value": "not publicly itemized per 1K for Search API",
    "source_url": "https://help.kagi.com/kagi/api/overview.html",
    "comment": "Kagi documents pay-per-use API portal billing but not a stable public Search API CPM in docs."
  },
  "free_tier_limits": {
    "value": "No free Search API allowance documented",
    "source_url": "https://help.kagi.com/kagi/api/quick-start.html",
    "comment": "API billing is separate from Kagi's consumer trial and requires a payment method or prepaid API credit."
  },
  "p50_latency": {
    "value": "Not publicly documented",
    "source_url": "https://help.kagi.com/kagi/api/search.html",
    "comment": "No provider-published p50 Web Search API latency was found."
  },
  "notes": ""
}
