{
  "name": "Keiro",
  "links": {
    "docs": "https://keirolabs.cloud/",
    "github": "https://github.com/dhruv-anand-aintech/anysearch",
    "website": "https://keirolabs.cloud",
    "slug": "keiro"
  },
  "env_keys": {
    "value": "KEIRO_API_KEY",
    "source_url": "https://keirolabs.cloud/",
    "comment": "API keys and configuration variables documented by the provider."
  },
  "python_extra": {
    "value": "\u2014 (REST only)",
    "source_url": "https://keirolabs.cloud/",
    "comment": "HTTP API only; no required vendor Python SDK."
  },
  "requires_key": {
    "support": "full",
    "source_url": "https://keirolabs.cloud/",
    "comment": "Valid API key required for every request."
  },
  "snippet": {
    "support": "full",
    "source_url": "https://keirolabs.cloud/",
    "comment": "Source rows are normalized from v2 `results` or compatible source arrays."
  },
  "domains": {
    "support": "none",
    "source_url": "https://keirolabs.cloud/",
    "comment": "Domain filters"
  },
  "country": {
    "support": "none",
    "source_url": "https://keirolabs.cloud/",
    "comment": "Country (gl)"
  },
  "language": {
    "support": "none",
    "source_url": "https://keirolabs.cloud/",
    "comment": "Language"
  },
  "date": {
    "support": "none",
    "source_url": "https://keirolabs.cloud/",
    "comment": "Published date range"
  },
  "safe_search": {
    "support": "none",
    "source_url": "https://keirolabs.cloud/",
    "comment": "Safe search"
  },
  "answer": {
    "support": "none",
    "source_url": "https://keirolabs.cloud/",
    "comment": "AI answer"
  },
  "content": {
    "support": "full",
    "source_url": "https://keirolabs.cloud/",
    "comment": "`include_content=true` routes to `/api/v2/search/content` and maps `full_text`."
  },
  "summary": {
    "support": "none",
    "source_url": "https://keirolabs.cloud/",
    "comment": "AI per-result summary"
  },
  "highlights": {
    "support": "none",
    "source_url": "https://keirolabs.cloud/",
    "comment": "Query highlights"
  },
  "news": {
    "support": "none",
    "source_url": "https://keirolabs.cloud/",
    "comment": "News search type"
  },
  "mode": {
    "values": [
      "fast",
      "balanced",
      "deep"
    ],
    "source_url": "https://keirolabs.cloud/",
    "comment": "v2 search endpoints exposed through `mode`: balanced uses `/api/v2/keirolabs`, fast/deep use `/api/v2/search/fast`, and content requests use `/api/v2/search/content`. KeiroLabs expects the API key in the JSON body."
  },
  "pricing_per_1k": {
    "value": "fast/balanced: ~$0.50; content: ~$1.50; batch: ~$0.50",
    "source_url": "https://keirolabs.cloud/",
    "comment": "Keiro docs list credit costs per v2 endpoint and headline cost per 1,000 searches."
  },
  "free_tier_limits": {
    "value": "500 searches/month; 30 req/min; no card",
    "source_url": "https://keirolabs.cloud/",
    "comment": "Explorer is a hard-capped free plan with no overage and no batch endpoint."
  },
  "p50_latency": {
    "value": "Not publicly documented",
    "source_url": "https://keirolabs.cloud/",
    "comment": "No provider-published p50 Web Search API latency was found."
  },
  "notes": "KeiroLabs v2 search is wired in the anysearch SDK as REST-only. The provider expects `apiKey`, `query`, and `maxResults` in the JSON request body."
}
