{
  "name": "Jina",
  "links": {
    "docs": "https://jina.ai/reader/",
    "github": "https://github.com/dhruv-anand-aintech/anysearch",
    "website": "https://jina.ai",
    "slug": "jina"
  },
  "env_keys": {
    "value": "JINA_API_KEY",
    "source_url": "https://jina.ai/reader/",
    "comment": "API keys and configuration variables documented by the provider."
  },
  "python_extra": {
    "value": "\u2014 (REST only)",
    "source_url": "https://jina.ai/reader/",
    "comment": "HTTP API only; no required vendor Python SDK."
  },
  "requires_key": {
    "support": "full",
    "source_url": "https://jina.ai/reader/",
    "comment": "Valid API key required for every request."
  },
  "snippet": {
    "support": "full",
    "source_url": "https://jina.ai/reader/",
    "comment": "Short description field returned with each result."
  },
  "domains": {
    "support": "none",
    "source_url": "https://jina.ai/reader/",
    "comment": "Domain filters"
  },
  "country": {
    "support": "none",
    "source_url": "https://jina.ai/reader/",
    "comment": "Country (gl)"
  },
  "language": {
    "support": "none",
    "source_url": "https://jina.ai/reader/",
    "comment": "Language"
  },
  "date": {
    "support": "none",
    "source_url": "https://jina.ai/reader/",
    "comment": "Published date range"
  },
  "safe_search": {
    "support": "none",
    "source_url": "https://jina.ai/reader/",
    "comment": "Safe search"
  },
  "answer": {
    "support": "none",
    "source_url": "https://jina.ai/reader/",
    "comment": "AI answer"
  },
  "content": {
    "support": "full",
    "source_url": "https://jina.ai/reader/",
    "comment": "Search returns markdown page bodies unless `X-Respond-With: no-content` is set."
  },
  "summary": {
    "support": "none",
    "source_url": "https://jina.ai/reader/",
    "comment": "AI per-result summary"
  },
  "highlights": {
    "support": "none",
    "source_url": "https://jina.ai/reader/",
    "comment": "Query highlights"
  },
  "news": {
    "support": "none",
    "source_url": "https://jina.ai/reader/",
    "comment": "News search type"
  },
  "mode": {
    "values": [
      "balanced"
    ],
    "source_url": "https://jina.ai/reader/",
    "comment": "Reader Search has no vendor fast/synthesis mode knob. Default returns SERP + optional page markdown; `X-Respond-With: no-content` is a fetch shortcut, not a latency tier."
  },
  "pricing_per_1k": {
    "value": "token-based; no fixed per-query CPM",
    "source_url": "https://jina.ai/reader/",
    "comment": "Reader/Search usage is priced by tokens/usage tiers rather than a fixed per-1K query price."
  },
  "free_tier_limits": {
    "value": "10M tokens for new users; 500 RPM / 1M TPM",
    "source_url": "https://api.jina.ai/docs",
    "comment": "Free Search Foundation tier also limits concurrency to five requests."
  },
  "p50_latency": {
    "value": "Search: 0.75s p50 / 1.32s p95 independent; 2.5s provider-reported average",
    "source_url": "https://proxyway.com/research/search-apis-2026-report",
    "comment": "Independent percentiles use three 2,000-query runs from the US East Coast. Jina's current rate-limit table reports a 2.5-second average for s.jina.ai.",
    "links": {
      "Independent benchmark": "https://proxyway.com/research/search-apis-2026-report",
      "Provider average": "https://jina.ai/deepsearch/"
    }
  },
  "notes": ""
}
