{
  "name": "Yandex \u00b7 SerpApi",
  "links": {
    "docs": "https://serpapi.com/yandex-search-api",
    "github": "https://github.com/dhruv-anand-aintech/anysearch",
    "website": "https://yandex.com",
    "slug": "serpapi_yandex"
  },
  "env_keys": {
    "value": "SERPAPI_API_KEY, SERPAPI_KEY",
    "source_url": "https://serpapi.com/search-api",
    "comment": "Same SerpApi key for all engines; anysearch uses `engine=\"yandex\"`."
  },
  "python_extra": {
    "value": "google-search-results",
    "source_url": "https://pypi.org/project/google-search-results/",
    "comment": "pip extra `serpapi`; call with `provider=\"serpapi\"`, `engine=\"yandex\"`."
  },
  "requires_key": {
    "support": "full",
    "source_url": "https://serpapi.com/search-api",
    "comment": "Valid API key required for every request."
  },
  "snippet": {
    "support": "full",
    "source_url": "https://serpapi.com/yandex-search-api",
    "comment": "Organic results via SerpApi `engine=yandex`."
  },
  "domains": {
    "support": "none",
    "source_url": "https://serpapi.com/yandex-search-api",
    "comment": "Domain filters"
  },
  "country": {
    "support": "full",
    "source_url": "https://serpapi.com/yandex-search-api",
    "comment": "`lr` \u2014 Yandex region id when supported."
  },
  "language": {
    "support": "full",
    "source_url": "https://serpapi.com/yandex-search-api",
    "comment": "Language via Yandex-specific params (see SerpApi docs)."
  },
  "date": {
    "support": "none",
    "source_url": "https://serpapi.com/yandex-search-api",
    "comment": "Published date range"
  },
  "safe_search": {
    "support": "full",
    "source_url": "https://serpapi.com/yandex-search-api",
    "comment": "Safe search"
  },
  "answer": {
    "support": "partial",
    "source_url": "https://serpapi.com/yandex-search-api",
    "comment": "Answer box when the engine JSON includes one (not explicitly requested)."
  },
  "content": {
    "support": "none",
    "source_url": "https://serpapi.com/yandex-search-api",
    "comment": "Full page text"
  },
  "summary": {
    "support": "none",
    "source_url": "https://serpapi.com/yandex-search-api",
    "comment": "AI per-result summary"
  },
  "highlights": {
    "support": "none",
    "source_url": "https://serpapi.com/yandex-search-api",
    "comment": "Query highlights"
  },
  "news": {
    "support": "none",
    "source_url": "https://serpapi.com/yandex-search-api",
    "comment": "News via SerpApi where a dedicated news engine exists for this backend."
  },
  "mode": {
    "values": [
      "balanced"
    ],
    "source_url": "https://serpapi.com/yandex-search-api",
    "comment": "Fixed SerpApi backend `engine=yandex` (set via anysearch `engine=\"yandex\"` with `provider=\"serpapi\"`). No separate fast/deep tier on this engine."
  },
  "pricing_per_1k": {
    "value": "balanced: $25 starter; ~$3.75-$15 volume",
    "source_url": "https://serpapi.com/pricing",
    "comment": "Monthly plan price divided by included searches; applies to all SerpApi engine rows."
  },
  "free_tier_limits": {
    "value": "250 searches/month; 50/hour",
    "source_url": "https://serpapi.com/pricing",
    "comment": "Free plan applies across SerpApi engines; only successful uncached searches consume quota."
  },
  "p50_latency": {
    "value": "Not publicly documented",
    "source_url": "https://serpapi.com/yandex-search-api",
    "comment": "No provider-published p50 Web Search API latency was found."
  },
  "notes": "SerpApi proxy to Yandex (`engine=yandex`). Native SDK package: google-search-results."
}
