{
  "name": "Firecrawl",
  "links": {
    "docs": "https://docs.firecrawl.dev/api-reference/endpoint/search",
    "github": "https://github.com/dhruv-anand-aintech/anysearch",
    "website": "https://www.firecrawl.dev",
    "slug": "firecrawl"
  },
  "env_keys": {
    "value": "FIRECRAWL_API_KEY",
    "source_url": "https://docs.firecrawl.dev/api-reference/endpoint/search",
    "comment": "API keys and configuration variables documented by the provider."
  },
  "python_extra": {
    "value": "firecrawl-py",
    "source_url": "https://pypi.org/project/firecrawl-py/",
    "comment": "Optional PyPI package: firecrawl-py (install via anysearch-sdk extra `firecrawl`)."
  },
  "requires_key": {
    "support": "full",
    "source_url": "https://docs.firecrawl.dev/api-reference/endpoint/search",
    "comment": "Valid API key required for every request."
  },
  "snippet": {
    "support": "full",
    "source_url": "https://docs.firecrawl.dev/api-reference/endpoint/search",
    "comment": "Short description field returned with each result."
  },
  "domains": {
    "support": "none",
    "source_url": "https://docs.firecrawl.dev/api-reference/endpoint/search",
    "comment": "Domain filters"
  },
  "country": {
    "support": "full",
    "source_url": "https://docs.firecrawl.dev/api-reference/endpoint/search",
    "comment": "`country` \u2014 ISO country code on POST /v2/search."
  },
  "language": {
    "support": "none",
    "source_url": "https://docs.firecrawl.dev/api-reference/endpoint/search",
    "comment": "Language"
  },
  "date": {
    "support": "none",
    "source_url": "https://docs.firecrawl.dev/api-reference/endpoint/search",
    "comment": "Published date range"
  },
  "safe_search": {
    "support": "none",
    "source_url": "https://docs.firecrawl.dev/api-reference/endpoint/search",
    "comment": "Safe search"
  },
  "answer": {
    "support": "none",
    "source_url": "https://docs.firecrawl.dev/api-reference/endpoint/search",
    "comment": "AI answer"
  },
  "content": {
    "support": "full",
    "source_url": "https://docs.firecrawl.dev/features/search",
    "comment": "`scrapeOptions.formats` (e.g. `markdown`) embeds full page text per hit."
  },
  "summary": {
    "support": "none",
    "source_url": "https://docs.firecrawl.dev/api-reference/endpoint/search",
    "comment": "AI per-result summary"
  },
  "highlights": {
    "support": "none",
    "source_url": "https://docs.firecrawl.dev/api-reference/endpoint/search",
    "comment": "Query highlights"
  },
  "news": {
    "support": "full",
    "source_url": "https://docs.firecrawl.dev/api-reference/endpoint/search",
    "comment": "`sources: [{\"type\": \"news\"}]` for news results."
  },
  "mode": {
    "values": [
      "balanced"
    ],
    "source_url": "https://docs.firecrawl.dev/features/search",
    "comment": "Single search tier (title, URL, description). `scrapeOptions` fetches page bodies but is not an AI synthesis `mode`."
  },
  "pricing_per_1k": {
    "value": "balanced/search: 2 credits per 10 results",
    "source_url": "https://www.firecrawl.dev/pricing",
    "comment": "Convert credits to dollars from your Firecrawl plan; advanced formats and extraction add credits."
  },
  "free_tier_limits": {
    "value": "1,000 credits/month (~500 searches at 10 results)",
    "source_url": "https://www.firecrawl.dev/pricing",
    "comment": "Search costs two credits per ten results; advanced features consume additional credits."
  },
  "p50_latency": {
    "value": "Search: <2s avg cited workload; search + scrape: ~4\u20135s; 3.4s p95 overall",
    "source_url": "https://www.firecrawl.dev/glossary/web-search-apis/search-latency-ai-agents",
    "comment": "Provider-reported figures with different scopes: a cited Stanford workload averaged under two seconds per search, search plus scrape is about 4\u20135 seconds, and Firecrawl advertises 3.4 seconds p95 across millions of pages.",
    "links": {
      "Search workload": "https://www.firecrawl.dev/glossary/web-search-apis/search-latency-ai-agents",
      "Search plus scrape": "https://www.firecrawl.dev/blog/llm-grounding",
      "Overall p95": "https://github.com/firecrawl/firecrawl"
    }
  },
  "notes": "Native SDK package: firecrawl-py."
}
